{
  "schema_version": "0.3.0",
  "system": {"id": "STAR_DELTA_01", "name": "15 kW Star-Delta Motor Starter", "status": "REVIEW_REQUIRED", "frequency_hz": 60, "base_power_kva": null},
  "components": [
    {"id": "GRID01", "type": "utility_grid", "name": "380 V Three-Phase Supply", "rated_parameters": {"voltage_v": 380, "frequency_hz": 60}, "operating_parameters": {"voltage_v": null}, "status": "IN_SERVICE", "terminals": [{"id": "PORT", "kind": "POWER", "role": "PORT", "phase": null}], "metadata": {"source": "USER_DESCRIPTION", "evidence_label": "DERIVED", "confidence": null, "notes": []}},
    {"id": "QS01", "type": "isolator", "name": "QS Three-Phase Isolator", "rated_parameters": {"voltage_v": 380, "current_a": null}, "operating_parameters": {}, "status": "CLOSED", "terminals": [{"id": "LINE", "kind": "POWER", "role": "LINE", "phase": null}, {"id": "LOAD", "kind": "POWER", "role": "LOAD", "phase": null}, {"id": "T1", "kind": "POWER", "role": "LOAD", "phase": "L1"}, {"id": "T2", "kind": "POWER", "role": "LOAD", "phase": "L2"}], "metadata": {"source": "USER_DESCRIPTION", "evidence_label": "DERIVED", "confidence": null, "notes": ["Current rating was not supplied."]}},
    {"id": "KM1", "type": "contactor", "name": "KM1 Main Contactor", "rated_parameters": {"voltage_v": 380, "current_a": null}, "operating_parameters": {}, "status": "DEENERGIZED", "terminals": [{"id": "LINE", "kind": "POWER", "role": "LINE", "phase": null}, {"id": "LOAD", "kind": "POWER", "role": "LOAD", "phase": null}, {"id": "A1", "kind": "COIL", "role": "COIL", "phase": null}, {"id": "A2", "kind": "COIL", "role": "COIL", "phase": null}], "control": {"coil": {"terminal_ids": ["A1", "A2"], "rated_voltage_v": 220, "frequency_hz": 60}, "contacts": [], "parent_component_id": null, "pole_count": 3, "delay_mode": null, "motor_connection": null, "trip_class": null}, "metadata": {"source": "USER_DESCRIPTION", "evidence_label": "DERIVED", "confidence": null, "notes": ["Main-contact terminal pairs are represented by the aggregate LINE/LOAD power connection."]}},
    {"id": "FR01", "type": "overload_relay", "name": "FR Thermal Overload Relay", "rated_parameters": {"voltage_v": 380, "current_a": null}, "operating_parameters": {}, "status": "IN_SERVICE", "terminals": [{"id": "LINE", "kind": "POWER", "role": "LINE", "phase": null}, {"id": "T1", "kind": "POWER", "role": "LOAD", "phase": "L1"}, {"id": "T2", "kind": "POWER", "role": "LOAD", "phase": "L2"}, {"id": "T3", "kind": "POWER", "role": "LOAD", "phase": "L3"}, {"id": "95", "kind": "CONTACT", "role": "CONTACT", "phase": null}, {"id": "96", "kind": "CONTACT", "role": "CONTACT", "phase": null}], "control": {"coil": null, "contacts": [{"id": "FR_NC", "kind": "OVERLOAD", "normal_state": "NC", "terminal_ids": ["95", "96"], "actuation": "THERMAL_TRIP", "delay_seconds": null}], "parent_component_id": null, "pole_count": 3, "delay_mode": null, "motor_connection": null, "trip_class": null}, "metadata": {"source": "USER_DESCRIPTION", "evidence_label": "DERIVED", "confidence": null, "notes": ["Trip class and current setting were not supplied."]}},
    {"id": "M01", "type": "motor", "name": "15 kW Three-Phase Induction Motor", "rated_parameters": {"voltage_v": 380, "power_kw": 15, "frequency_hz": 60, "current_a": null, "power_factor": null}, "operating_parameters": {"power_kw": null}, "status": "IN_SERVICE", "terminals": [{"id": "U1", "kind": "POWER", "role": "MOTOR_WINDING", "phase": "U"}, {"id": "V1", "kind": "POWER", "role": "MOTOR_WINDING", "phase": "V"}, {"id": "W1", "kind": "POWER", "role": "MOTOR_WINDING", "phase": "W"}, {"id": "U2", "kind": "POWER", "role": "MOTOR_WINDING", "phase": "U"}, {"id": "V2", "kind": "POWER", "role": "MOTOR_WINDING", "phase": "V"}, {"id": "W2", "kind": "POWER", "role": "MOTOR_WINDING", "phase": "W"}], "control": {"coil": null, "contacts": [], "parent_component_id": null, "pole_count": null, "delay_mode": null, "motor_connection": "STAR_DELTA", "trip_class": null}, "metadata": {"source": "USER_DESCRIPTION", "evidence_label": "DERIVED", "confidence": null, "notes": ["Rated current and power factor were not supplied."]}},
    {"id": "KM2", "type": "contactor", "name": "KM2 Delta Contactor", "rated_parameters": {"voltage_v": 380, "current_a": null}, "operating_parameters": {}, "status": "DEENERGIZED", "terminals": [{"id": "L1", "kind": "POWER", "role": "LINE", "phase": "L1"}, {"id": "L2", "kind": "POWER", "role": "LINE", "phase": "L2"}, {"id": "L3", "kind": "POWER", "role": "LINE", "phase": "L3"}, {"id": "T1", "kind": "POWER", "role": "LOAD", "phase": "L1"}, {"id": "T2", "kind": "POWER", "role": "LOAD", "phase": "L2"}, {"id": "T3", "kind": "POWER", "role": "LOAD", "phase": "L3"}, {"id": "A1", "kind": "COIL", "role": "COIL", "phase": null}, {"id": "A2", "kind": "COIL", "role": "COIL", "phase": null}], "control": {"coil": {"terminal_ids": ["A1", "A2"], "rated_voltage_v": 220, "frequency_hz": 60}, "contacts": [], "parent_component_id": null, "pole_count": 3, "delay_mode": null, "motor_connection": "DELTA", "trip_class": null}, "metadata": {"source": "USER_DESCRIPTION", "evidence_label": "DERIVED", "confidence": null, "notes": []}},
    {"id": "KM3", "type": "contactor", "name": "KM3 Star Contactor", "rated_parameters": {"voltage_v": 380, "current_a": null}, "operating_parameters": {}, "status": "DEENERGIZED", "terminals": [{"id": "L1", "kind": "POWER", "role": "LINE", "phase": "L1"}, {"id": "L2", "kind": "POWER", "role": "LINE", "phase": "L2"}, {"id": "L3", "kind": "POWER", "role": "LINE", "phase": "L3"}, {"id": "T1", "kind": "POWER", "role": "LOAD", "phase": "L1"}, {"id": "T2", "kind": "POWER", "role": "LOAD", "phase": "L2"}, {"id": "T3", "kind": "POWER", "role": "LOAD", "phase": "L3"}, {"id": "A1", "kind": "COIL", "role": "COIL", "phase": null}, {"id": "A2", "kind": "COIL", "role": "COIL", "phase": null}], "control": {"coil": {"terminal_ids": ["A1", "A2"], "rated_voltage_v": 220, "frequency_hz": 60}, "contacts": [], "parent_component_id": null, "pole_count": 3, "delay_mode": null, "motor_connection": "STAR", "trip_class": null}, "metadata": {"source": "USER_DESCRIPTION", "evidence_label": "DERIVED", "confidence": null, "notes": []}},
    {"id": "STAR_POINT", "type": "bus", "name": "Switched Star Point", "rated_parameters": {"voltage_v": 380}, "operating_parameters": {}, "status": "IN_SERVICE", "terminals": [{"id": "S1", "kind": "POWER", "role": "COMMON", "phase": null}, {"id": "S2", "kind": "POWER", "role": "COMMON", "phase": null}, {"id": "S3", "kind": "POWER", "role": "COMMON", "phase": null}], "metadata": {"source": "USER_DESCRIPTION", "evidence_label": "DERIVED", "confidence": null, "notes": ["Internal switched star point; energized only through KM3."]}},
    {"id": "JBK01", "type": "control_transformer", "name": "JBK 220 V Control Transformer", "rated_parameters": {"primary_voltage_v": 380, "secondary_voltage_v": 220, "apparent_power_kva": null, "frequency_hz": 60}, "operating_parameters": {}, "status": "IN_SERVICE", "terminals": [{"id": "PRIMARY", "kind": "POWER", "role": "PRIMARY", "phase": null}, {"id": "SECONDARY", "kind": "CONTROL", "role": "SECONDARY", "phase": null}, {"id": "N", "kind": "CONTROL", "role": "CONTROL_SUPPLY", "phase": "N"}], "metadata": {"source": "USER_DESCRIPTION", "evidence_label": "DERIVED", "confidence": null, "notes": ["Transformer capacity was not supplied."]}},
    {"id": "FU01", "type": "fuse", "name": "Control Fuse", "rated_parameters": {"voltage_v": 220, "current_a": null}, "operating_parameters": {}, "status": "IN_SERVICE", "terminals": [{"id": "LINE", "kind": "CONTROL", "role": "LINE", "phase": null}, {"id": "LOAD", "kind": "CONTROL", "role": "LOAD", "phase": null}], "metadata": {"source": "USER_DESCRIPTION", "evidence_label": "DERIVED", "confidence": null, "notes": ["Fuse current rating was not supplied."]}},
    {"id": "SB1E", "type": "push_button", "name": "Stop Push Button", "rated_parameters": {"voltage_v": 220, "current_a": null}, "operating_parameters": {}, "status": "CLOSED", "terminals": [{"id": "11", "kind": "CONTACT", "role": "CONTACT", "phase": null}, {"id": "12", "kind": "CONTACT", "role": "CONTACT", "phase": null}], "control": {"coil": null, "contacts": [{"id": "STOP_NC", "kind": "AUXILIARY", "normal_state": "NC", "terminal_ids": ["11", "12"], "actuation": "IMMEDIATE", "delay_seconds": 0}], "parent_component_id": null, "pole_count": 1, "delay_mode": null, "motor_connection": null, "trip_class": null}, "metadata": {"source": "USER_DESCRIPTION", "evidence_label": "DERIVED", "confidence": null, "notes": []}},
    {"id": "SB2", "type": "push_button", "name": "Start Push Button", "rated_parameters": {"voltage_v": 220, "current_a": null}, "operating_parameters": {}, "status": "OPEN", "terminals": [{"id": "13", "kind": "CONTACT", "role": "CONTACT", "phase": null}, {"id": "14", "kind": "CONTACT", "role": "CONTACT", "phase": null}], "control": {"coil": null, "contacts": [{"id": "START_NO", "kind": "AUXILIARY", "normal_state": "NO", "terminal_ids": ["13", "14"], "actuation": "IMMEDIATE", "delay_seconds": 0}], "parent_component_id": null, "pole_count": 1, "delay_mode": null, "motor_connection": null, "trip_class": null}, "metadata": {"source": "USER_DESCRIPTION", "evidence_label": "DERIVED", "confidence": null, "notes": []}},